{
  "exp": 100,
  "gender": "female",
  "ability_id": "Static",
  "nature_id": "Bashful",
  "hp": 12,
  "iv": {
    "hp": 10,
    "atk": 10,
    "def": 10,
    "sp_atk": 10,
    "sp_def": 10,
    "speed": 10
  },
  "ev": {
    "hp": 10,
    "atk": 10,
    "def": 10,
    "sp_atk": 10,
    "sp_def": 10,
    "speed": 10
  },
  "moves": [
    {
      "move_id": "Thunder Shock",
      "pp": 30,
      "max_pp": 40
    }
  ],
  "friendship": 70,
  "growth_events": [

  ],
  "species_id": "Pikachu"
}
